title , platform , release_date , developer , genres , reviewer , metascore , review
Fairy Fencer F,PlayStation 3,Sep-16-2014,Compile Heart,Role-Playing | General | Japanese-Style,Game Revolution,40,There just isn’t anything of note really in Fairy Fencer F. It looks outdated feels meh at best and Seriously really? at worst.
A Virus Named TOM,PC,Aug-1-2012,Misfits Attic,Miscellaneous | Puzzle | Action | Puzzle | Action,PC Gamer UK,55,The extra frills dont add thrills to the tried Pipemania template. [Oct 2012 p.90]
Shotest Shogi,Xbox 360,Sep-10-2008,AI Factory | Rubicon Development Ltd.,Miscellaneous | Board Games | Board Games | Board / Card Game,IGN,60,Shogi is the kind of game that you can get hooked on. If you enjoy chess playing and learning this variant will be right up your alley. However the 800 Microsoft point ($10 US) price tag will have you wishing more effort would have been put into the presentation and game options.
007: Quantum of Solace,PlayStation 3,Nov-4-2008,Treyarch,Action | General | Shooter | Shooter | First-Person | Modern | Modern | Arcade,Video Game Talk,30,Its a dreary repetitive affair that never makes you feel excited to be in the shoes of James Bond.
Barnyard,Wii,Dec-4-2006,Blue Tongue Entertainment,Action | Adventure | General | General,Gaming Age,42,Unfortunately due to the boring missions and the slow moving character and pace I would pass on Barnyard.
Pac-Man World 3,Xbox,Nov-17-2005,Blitz Games,Action | Platformer | 3D,Official Xbox Magazine,40,Mind-numbingly repetitive. [Jan 2006 p.75]
Dynasty Warriors 9,PlayStation 4,Feb-13-2018,Omega Force,Action | Action Adventure | Beat-'Em-Up | Open-World | 3D,Metro GameCentral,40,Dynasty Warriors finally gets the overhaul it’s long been waiting for… and while it addresses a few old problems it creates just as many new ones.
Super Motherload,PlayStation 4,Nov-15-2013,XGenStudios,General | Puzzle | Miscellaneous | Puzzle | Action,4Players.de,47,Playing this digging puzzler made me almost fall asleep. But as soon as you get a few players to help you you’ll uncover some fun buried under all that rubble.
SingStar Dance,PlayStation 3,Nov-1-2010,SCEE London Studio,Action | Miscellaneous | Rhythm | Music Maker | Music Maker | Dancing,PSM3 Magazine UK,48,Why didnt they make it better? [Christmas 2010 p.89]
War the Game,PC,Jan-12-2015,GabberGames,Strategy | Real-Time | Military,Games.cz,40,Its low price tag is not enough to overshadow the fact that War the Game delivers minimum content. Although it is natural to raise objections to its strategical aspect a small number of scenarios and no multiplayer game are the things that are fatally snapping its neck.
MachiaVillain,PC,May-16-2018,Wild Factor,Action | General,Games Master UK,45,A well-presented game but exploring shows its more dilapidated cabin than ominous mansion. [July 2018 p.65]
Resident Evil: The Mercenaries 3D,3DS,Jun-28-2011,Capcom,Action | Action Adventure | Horror | Horror | Shooter | Survival | Third-Person | Tactical,1UP,25,Its hard to shake the feeling that Mercenaries 3D is the slimy result of a Capcom executive meeting titled What can we get away with this time?
Cate West: The Vanishing Files,Wii,Mar-23-2009,Destineer,Adventure | General | General | Point-and-Click,Nintendo Gamer,59,An acquired taste and definitely not for impatient gamers. [Nov 2009 p.69]
Birthdays the Beginning,PlayStation 4,May-9-2017,Arc System Works,Strategy | Management | Business / Tycoon | Action Adventure | Sandbox,GameCritics,45,While I absolutely love the concept of Birthdays: The Beginning the execution leaves much to be desired. It’s too passive and too finicky and doesn’t do enough with the core concept of life appearing and evolving over time. There’s not much here for seasoned players or curious kids and as someone who’s been playing games for a while I can say that this formula was done far far better on the SNES back in 1993 with EVO: Search For Eden. Look it up!
Gladiator: Sword of Vengeance,Xbox,Nov-5-2003,Acclaim Studios Manchester,Action | Beat-'Em-Up,GamePro,40,It has some slick production values and Acclaim goes all out on dreamy visuals gorgeously detailed architecture a Vikingly heroic score and juicy sound effects but skimps on any kind of depth and rewarding gameplay.
EyePet & Friends,PlayStation 3,Nov-15-2011,SCEE London Studio,Simulation | Miscellaneous | Virtual Life | Virtual | Virtual Life,Official PlayStation Magazine Benelux,55,Like in the previous Eyepet-games you never really get the feeling that you are actually petting the animals. Yes the animal reacts to the Move but the interaction is very limited. Its fun to toy around with the technology for a while but after that it gets boring. [December 2011 p.89]
Prince of Persia: The Forgotten Sands,PSP,May-17-2010,Ubisoft Quebec,Action Adventure | Fantasy | General | Fantasy,Gamekult,40,A mediocre game well forget quite easily.
The Escapists: The Walking Dead,Xbox One,Sep-30-2015,Team17,Action | General,Official Xbox Magazine UK,40,There are brief hints at what might have been but otherwise this is a walking dud. [Dec 2015 p.81]
Exit 2,Xbox 360,Feb-25-2009,Taito Corporation,Miscellaneous | Puzzle | Action | Puzzle | Action,Thunderbolt,40,A disappointing outing from Mr Esc and his associates as we’ll be expecting something very different for the next installment.
M.A.C.H. Modified Air Combat Heroes,PSP,Feb-20-2007,VU Games,Action | Racing | General | General | Arcade | Other,Jolt Online Gaming UK,49,M.A.C.H is a sad waste of potential that feels like no one actually cared to deliver anything innovative or even competent.
Help Wanted: 50 Wacky Jobs,Wii,May-12-2009,Hudson Soft,Simulation | General | General,Nintendo Power,45,Times are tough but this is one job offer you should pass up. [June 2009 p.90]
Gauntlet,Xbox 360,Nov-22-2005,Digital Eclipse,Action | General | General | Arcade,WHAM! Gaming,30,The worst part is you can basically hit a button to get more and more health as opposed to adding quarters in the arcades back in the day.
Syphon Filter: The Omega Strain,PlayStation 2,May-4-2004,Sony Bend,Action | Shooter | Third-Person | Tactical | Modern,Gaming Age,16,Syphon Filter: The Omega Strain easily ranks among the worst titles I have ever played on the PlayStation 2 an astounding feat considering that the game came from Sony themselves.
Lords of the Realm III,PC,Mar-17-2004,Impressions Games,Strategy | Real-Time | Historic | General,Computer and Video Games,19,God knows what happened to LOTR3 but the usually dependable Impressions Games has lost the plot on this one. Even if youre a long-standing fan of the series - no especially if you are one - avoid this like a bearded Black Death-infected Saxon whore.
Tao Feng: Fist of the Lotus,Xbox,Mar-18-2003,Studio Gigante,Action | Fighting | 3D,GameSpy,38,It takes a few stabs at innovating but alas its turned out to be worse than mediocre: its lousy.
Strike Fighters: Project 1,PC,Oct-27-2002,Third Wire,Simulation | Flight | Old Jet | Combat,Computer Gaming World,40,Numerous bugs and missing features indicate Strike Fighters was pushed out the door a few months before its time. Again. [Mar 2003 p.105]
S.W.I.N.E.,PC,Nov-19-2001,Stormregion,Strategy | Real-Time | General | Tactics,Computer Gaming World,40,I dont think Ive ever seen worse pathfinding in a game. [May 2002 p.75]
Tennis Masters Series,PC,Nov-18-2001,Microids,Sports | Traditional | Individual | Tennis | Tennis,Yahoo!,40,Yet another addition to the long line of awful tennis games for the PC.
Hoard,PC,Apr-4-2011,Big Sandwich Games | Inc.,Action | General | General,Gaming Age,42,The problem I found is that it felt like the RTS equivalent of button mashing; if I lost Id just as soon turn it off than feel all that compelled to try a different strategy. A shame really because theres nothing technically wrong with the game.
Juiced: Eliminator,PSP,Jun-28-2006,Juice Games,Driving | Racing | Simulation | GT / Street | GT / Street | Automobile,Modojo,40,Juiced: Eliminator isnt bottom of the barrel but it comes in at a distant third when the underground racing genre has already gone well into its life span and thats not good news.
Party Hard,PlayStation 4,Apr-26-2016,Pinokl Games,Action | General,DarkStation,50,Party Hard presents some interesting ideas and has a promising start but it sours quickly due to repetitive game design and a frustrating inconsistency in difficulty.
MS Saga: A New Dawn,PlayStation 2,Feb-21-2006,Bandai,Role-Playing | General,Yahoo!,40,A game with no surprises and a superficial combat model but giant robot fetishists and long-time series fans at least have one less reason to complain.
Away: Shuffle Dungeon,DS,Oct-30-2008,Mistwalker | Artoon,Role-Playing | General | General,Metro GameCentral,40,Its all a shame because the central idea of a constantly transforming dungeon is a good one. The actual game thats been constructed around it though is nowhere near good enough.
Wild West Guns,Wii,Aug-4-2008,Gameloft,Action | Shooter | Shooter | Light Gun | Light Gun,Zentendo,50,Wild West Guns is best looked at as perhaps a good first attempt. It has good settings and sound to suck you in to the Wild West theme but the actual gameplay just falls short. The controls are great and responsive but the game itself is just too repetitive and gets boring quickly. If more variety had been added then perhaps a higher score could have been given.
World Championship Poker 2: Featuring Howard Lederer,PSP,Dec-11-2005,Crave,Miscellaneous | Parlor | Gambling | Gambling,AceGamez,40,It isnt a terrible game but neither is it a good one. For those wanting to play a game of poker without the hassle of dealing cards or finding friends to play against then this game is an adequate substitute.
Crash 'N' Burn,Xbox,Nov-16-2004,Climax Group,Driving | Racing | Arcade,The Sydney Morning Herald,50,While the cars in other games fold and dent realistically depending on the speed and direction of the impact damage to Crash n Burns cars seems artificial with entire panels suddenly replaced with scratched versions at the merest hint of a high-speed nudge.
Need for Speed Underground 2,DS,May-10-2005,EA Canada,Driving | Racing | Simulation | GT / Street | GT / Street | Automobile,Pelaaja (Finland),40,The unique capabilities of DS’s dual screens are not used very well. Touch screen serves only as a map and as touch activation for nitro boost. As a driving game NFSU 2 DS does not feed the need for speed. Driving simply feels too slow paced. [August 2005 p.68]
Painkiller: Overdose,PC,Oct-26-2007,Mindware Studios,Action | Shooter | Shooter | First-Person | Fantasy | Fantasy | Arcade,PC Zone UK,38,A headache. [Feb 2008 p.88]
Bee Simulator,Switch,Nov-12-2019,Varsav Game Studios,Simulation | General,DarkZero,40,The premise for Bee Simulator is good and I like the idea of doing education through video games in such a uniquely refreshing way but the execution here has problems. When the game is not asking much from the player then Bee Simulator ends up being somewhat fun with a great sense of scale but the controls hamper such an important part of the game that the experience ends up being frustrating. Throw in repetitive tasks and muddy visuals and what you have is a video game that sadly does not deliver on its potential. It is hard to recommend Bee Simulator out right especially at its asking price but some of the younger kids might enjoy what Bee Simulator has to offer.
Morphite,Switch,Nov-2-2017,Crescent Moon Games,Action Adventure | General,TheSixthAxis,30,There is such a thing as being too laid-back and Morphite is most certainly that. With visuals that are too basic and lacking in character an almost sleep inducing pace and some technical issues on Switch that can’t be ignored there are few redeeming qualities for this utter snooze-fest.
The Chronicles of Narnia: The Lion The Witch and The Wardrobe,DS,Nov-14-2005,Amaze Entertainment,Action Adventure | Fantasy | General | Fantasy,Gaming Age,25,The graphics are there as is some of the sound and a few decent gameplay elements but the boring combat system repetitive scenery and horrible menu set up really keeps the game from ever becoming more than a mediocre waste of time.
Arena Football,Xbox,Feb-7-2006,EA Tiburon,Sports | Traditional | Football | Arcade,G4 TV,40,Arena Football may be an engaging sport to watch in real life with the excitement of packed arenas and the promise of frenzied action on the shortened field but the developers did a poor job in conveying that sense of atmosphere in the game.
The Walking Dead: Michonne - Episode 1: In Too Deep,Xbox One,Feb-23-2016,Skybound LLC | Skybound Games,Adventure | 3D | Third-Person,Official Xbox Magazine UK,50,Its easy to accredit the success of Telltales original Walking Dead to the strength of the fiction its working with but this flat opening salvo lacks the same nuances. [Apr 2016 p.77]
Sparkle 2,Xbox One,Jan-27-2016,10tons Entertainment | 10tons,Puzzle | Matching,We Got This Covered,30,Sparkle 2 is a clone of an almost 20 year old game and does nothing interesting with the core idea introduced in Puzz Loop.
Prince of Persia Revelations,PSP,Dec-6-2005,Pipeworks Software | Inc.,Action Adventure | Fantasy | Fantasy | Linear,NTSC-uk,30,People wanting a game to get their teeth into will certainly find it a challenge although many will also be tearing their hair out by the handful. The one question on many people’s lips is why port Warrior Within of all the games in the Prince of Persia trilogy? Why not simply begin with Sands of Time and start at the beginning.
Tim Burton's The Nightmare Before Christmas: Oogie's Revenge,PlayStation 2,Oct-10-2005,Capcom,Action Adventure | Horror,GamerFeed,40,While it captures the sweet essence of the film from so long ago it fails to motivate with its stale gameplay.
Outward,Xbox One,Mar-26-2019,Nine Dots Studio,Role-Playing | Action Adventure | General | Survival | Open-World,GameSpew,50,It’s undeniable that Outward‘s combat is sub-par and that its systems prove to be very punishing when combined.
Choplifter HD,Xbox 360,Jan-11-2012,InXile Entertainment,General | Action | Shooter | Shooter | Scrolling | Scrolling | Shoot-'Em-Up | Vertical,Gameblog.fr,40,The concept gameplay challenge and atmosphere of Choplifter HD are quite good. It is a nice trip back in the 80s even if it is far from being a must-have today as the game is particulary repetitive and its price is quite high.
Cookie & Cream,DS,Jul-2-2007,Hi Corp,Action | Platformer | Platformer | 3D | 3D,GamesRadar+,30,There’s some minigames and a wi-fi Battle mode but good luck trying to play with a friend more than once. We wanted to adore Cookie & Cream; it’s a shame we only get a clumsy mess.
Secret Files: Tunguska,Wii,Jun-22-2010,10tacle Studios | Fusionsphere Systems,Adventure | Third-Person | General | Modern,games(TM),50,Dedicated genre fans meanwhile will find that the concessions in the gameplay – pre-highlighted hot spots and rumble hints – are both insulting to their intelligence and at odds with the entire point of the adventure genre. [June 2008 p.123]
Dracula 3: The Path of the Dragon,PC,Aug-21-2008,Kheops Studio,Adventure | 3D | First-Person | Modern | Modern,GameSpot,50,Dreary and dated.
The Awakened Fate: Ultimatum,PlayStation 3,Mar-17-2015,Nippon Ichi Software,Role-Playing | General | Roguelike,PlayStation Universe,40,A shell of its predecessor. All the fun mechanics from Guided Fate Paradox have been removed and changed leaving a generic but tedious combat system. The story while potentially interesting has major pacing and voice acting issues that dull the experience. Only a diehard NIS fan will want to play this game.
Blacklight: Tango Down,PC,Jul-14-2010,Zombie Studios,Action | Shooter | Shooter | First-Person | Modern | Tactical | Modern | Arcade,LEVEL (Czech Republic),50,Absences of multi-player opponents and lack of any in-game improvements are the major disadvantages of this average first person shooter. [Issue#195]
Sherlock Holmes: The Devil's Daughter,PC,Jun-10-2016,Frogwares,Adventure | General,PCWorld,40,Three weak cases one decent and a lackluster finale make Sherlock Holmes: The Devils Daughter a marked step back from its predecessor.
Matt Hazard: Blood Bath and Beyond,PlayStation 3,Jan-7-2010,Vicious Cycle,Action | Action Adventure | Modern | Shooter | Scrolling | Shoot-'Em-Up | Vertical,GameShark,33,If it wasn’t bad enough that the game pokes fun at its previous release saying it can be picked at a bargain bin near you and continues the self-deprecating with a quip at the end dealing with the dreadfulness you just played through one can’t help but agree and have a sort of resentment that the developers knew the game was not up to par with other XBLA - or even Xbox Live Indie games - but still went ahead and released it which is probably the most humorous thing the game has going for it.
Blair Witch,PlayStation 4,Dec-3-2019,Bloober Team,Action Adventure | Survival,Push Square,40,Blair Witchs strongest aspect -- its eerie woodland setting -- is perfect for a focused streamlined horror experience. Unfortunately thats not what this game is and the superfluous gimmicky gameplay mechanics that are thrown at you with reckless abandon only serve to make the game less effective as a whole. A disappointing story frustrating level design and precious few genuine scares leaves us hoping that this is one franchise that gets lost in the woods.
Metal Wolf Chaos XD,PC,Aug-6-2019,From Software | General Arcade,Simulation | Vehicle | Combat,GameSpot,40,Metal Wolf Chaos is an old game with a wild reputation and though it lives up to it in some ways its not good in general. At best its a curio that helps inform the story of From Softwares trajectory over the years. At worst its a frustratingly shallow experience that fails to capitalize on its best qualities.
Monster Energy Supercross - The Official Videogame 2,Xbox One,Feb-5-2019,Milestone S.r.l,Racing | Arcade | Automobile,Xbox Tavern,50,Considering that it’s a sequel and despite its efforts Monster Energy Supercross 2 doesn’t feel wholly refined overall. The game suffers considerably due to its loose handling its steep difficulty curve and its excessive loading times. That said there’s enough diverse content on offer to keep die-hard fans entertained until next time. Just don’t expect the quality to have come on in leaps and bounds in comparison to its predecessor.
Smash Hit Plunder,PlayStation 4,Dec-11-2018,Triangular Pixels,Strategy | General,PlayStation Country,50,Smash Hit Plunder is an accessible looting game that sticks to one simple concept which is smashing everything in sight. It works well for a while but fell a bit flat after repeated play sessions. The asynchronous multiplayer options are a nice addition but you might struggle to find players who want to play this more than once.
Gekido: Kintaro's Revenge,Switch,Mar-22-2018,Naps Team,Action | Beat-'Em-Up | 2D,Switch Player,40,Gekido Kintaro’s Revenge is a very simple beat-em-up which probably didn’t warrant a physical release on Switch. Unfair gameplay unsatisfying visuals and sloppy proofing work mean this is one to miss.
Human: Fall Flat,Switch,Dec-7-2017,No Brakes Games,Action Adventure | General,Cubed3,30,Human: Fall Flat on Nintendo Switch is neither good if labelled as a purposely bad game nor as a physics puzzler. Why? It is purely because the controls make things more aggravating than hilarious and secondly due to how uninspiring the puzzles themselves are. Thats why.
Star Wars Battlefront II,PC,Nov-17-2017,EA DICE,Action | Shooter | First-Person | Tactical,Destructoid,50,As much as I loathe this implementation of loot boxes I still keep playing Battlefront II and I will probably continue to do so on and off. I mean I do like the game. I just wish it wasnt being squandered like this. Youd be well-advised to wait until overhauls arrive -- assuming they ever do.
Xenoraid,PlayStation 4,Nov-8-2016,10tons Entertainment | 10tons Ltd | 10tons,Action | Shooter | Shoot-'Em-Up | Vertical,Impulsegamer,50,Xenoraid is competently built but lacks any real reason to actually compel you to play it. The gameplay loop quickly becomes monotonous and aside from quick bursts here and there whilst waiting for a download I can’t see many gamers putting much time into conquering the alien attackers.
Abyss Odyssey: Extended Dream Edition,PlayStation 4,Jul-28-2015,ACE Team,Action Adventure | Linear,Twinfinite,40,This game so difficult to play through in the first place: the clunky and robotic feel of your characters and their movements. Extended Dream Edition is a regurgitation of the same nightmare that surfaced last year and I can’t recommend it to anyone who isn’t already utterly enamored with the game’s beautiful aesthetics.
War for the Overworld,PC,Apr-2-2015,Subterranean Games,Strategy | Real-Time | Fantasy | General | Fantasy,Gamer.nl,45,War for the Overworld was supposed to be the new Dungeon Keeper. They were on the right track but the game that is available for download now is definitely not right; lots of bugs crashes bad AI and many missing features make this game impossible to recommend.
Rio,PlayStation 3,Apr-12-2011,Eurocom Entertainment Software | Eurocom,Miscellaneous | General | General,Gamekult,30,Quotation forthcoming.
Rogue Ops,GameCube,Oct-29-2003,Bits Studios,Action Adventure | Modern,Edge Magazine,20,Objects that can be interacted with are circled with an icon but this only appears if you are looking at exactly the right spot. Indeed much of Rogue Ops is spent trying to make this cursed cursor appear. Its not a pleasant way to spend an evening. [Feb 2004 p.108]
Summer Heat Beach Volleyball,PlayStation 2,Jul-1-2003,Acclaim Studios Cheltenham,Sports | Traditional | Volleyball,PSM Magazine,30,Plagued with underdeveloped AI and repetitive clunky gameplay SHBV is one of the least appealing games of 2003. [Sept 2003 p.38]
Gungrave,PlayStation 2,Sep-16-2002,Seta Corporation,Action | Shooter | Third-Person | Fantasy,Game Revolution,33,A great animated cartoon cleverly disguised as a rather lame Playstation 2 game. Great presentation is wasted on forgettable gameplay.
Mad Maestro!,PlayStation 2,Mar-12-2002,Desert Productions,Miscellaneous | Rhythm | Music,Game Revolution,33,Pressing one button over and over at different pressure levels doesnt ring my bell and I doubt it will ring most of yours.
Darkened Skye,PC,Jan-27-2002,Boston Animation,Action | Action Adventure | General | General | Fantasy,Game Revolution,50,Rather than mixing action adventure and puzzle a narrower focus with more snide remarks and witty writing would have led to a better game.
Monsters Inc. Scream Team,PlayStation,Oct-30-2001,Artificial Mind and Movement,Action | General,Game Revolution,50,Fine for its intended audience. Simple gameplay with familiar heroes is enough to keep the little ones occupied for a while. Just dont expect anyone over the age of six to go ga-ga over it.
Thunderstrike: Operation Phoenix,PlayStation 2,Oct-15-2001,Core Design Ltd.,Action | Simulation | Shooter | Flight | Third-Person | Helicopter | Modern,Official U.S. Playstation Magazine,30,Why does the game look like crap? [Jan 2002 p.141]
Yoshi's New Island,3DS,Mar-14-2014,Arzest,Action | Platformer | 2D,Eurogamer,40,It might look a little like Yoshis Island then but its a worse game in every regard. 19 years on from the original its design has been denuded of almost everything that made it great: a series once fecund with ideas is now coasting on past glories.
Alpha Protocol,PlayStation 3,Jun-1-2010,Obsidian Entertainment,Role-Playing | Console-style RPG | Console-style RPG | Western-Style,The Escapist,40,The RPG elements work well and are loads of fun to explore but they only add up to half a game. Whats left over is a brainless broken mess.
Dynasty Warriors: Gundam Reborn,PlayStation 3,Jul-1-2014,Omega Force,Action | Beat-'Em-Up | 3D,4Players.de,41,Reborn – sounds like a new beginning doesn’t it? But it isn’t. This is little more than a superficial sequel that at its core is less satisfying than its predecessor.
F1 2015,Xbox One,Jul-21-2015,Codemasters,Racing | Simulation | Automobile,Pure Xbox,40,Were not exactly seeing what the wait was for when it comes to F1 2015. The game is clearly rushed riddled with bugs and lacking in some relatively basic features.
Monopoly Streets,PlayStation 3,Oct-26-2010,Electronic Arts,Miscellaneous | Board Games | Board Games | Board / Card Game,Gameblog.fr,40,Monopoly Streets does have some aces to play but cant make us forget that its still funnier with the real tabletop version.
Danger Zone,PC,May-29-2017,Three Fields Entertainment,Racing | General | Arcade | Automobile,Quarter to Three,40,Danger Zone is good for a couple of fancy crashes and not much else before an uninstall. It’s like a mild hit-and-run where it was never really worth taking the other driver’s insurance information anyway.
Diner Dash: Sizzle & Serve,DS,May-23-2007,Climax Group | PlayFirst | Climax Studios,Miscellaneous | Puzzle | Action | Puzzle | General | Puzzle | General | Action,Nintendo Gamer,45,Its very little fun to play and since you can play a limited version online for free as a Flash game theres no good reason to put it in your DS. [June 2007 p.70]
Mario Party 7,GameCube,Nov-7-2005,Hudson,Miscellaneous | Party,Eurogamer,30,Its such a shame that Nintendo - the creator of Mario Kart which is arguably the most fun you can have with platonic friends - just cant seem to sort Mario Partys problems out even for the seventh instalment in the series. Roll on number eight eh.
Secret Files 2: Puritas Cordis,PC,Oct-29-2009,Fusionsphere Systems | Animation Arts,Adventure | General | General,Total PC Gaming,50,An interesting story but the overall package isnt engaging enough. [Issue#20 p.56]
