title , platform , release_date , developer , genres , reviewer , metascore , review
Spyro: A Hero's Tail,Xbox,Nov-3-2004,Eurocom Entertainment Software,Action | Platformer | 3D,Stuff,40,We grew bored of the sheer repetitiveness of the game play and not even Spyros smart-ass remarks could keep us amused. Just talk to the hand Spyro. Snap!
Onimusha Tactics,Game Boy Advance,Nov-11-2003,Capcom,Strategy | Turn-Based | Fantasy,Nintendojo,35,Onimusha Tactics wouldnt be that bad if there werent so many strategy games already available to the GBA. But there are. And compared to the rest of the flock Onimusha sucks.
AO Tennis 2,Switch,Feb-11-2020,Big Ant Studios,Sports | Individual | Tennis,FNintendo,50,AO Tennis 2 on the Nintendo Switch sets expectations high but for a tennis simulation everything falls below the required standards. While the career mode and the player creation tool are interesting the games cast of players feels disconnected from reality while the gameplay feels too demanding and the graphics are simply out of date for the current time. Adding some performance issues to that doesnt make AO Tennis 2 any better and in the end what could have been a good tennis simulation falls into a more disappointing side of the spectrum.
Bloo Kid 2,3DS,May-7-2015,winterworks,Action | Platformer | 2D,Digitally Downloaded,20,Its a horribly generic platformer that tries hard to be some kind of homage to the genres greats and ends up being a pale imitation of them all. Sure its cheap as chips on the Nintendo 3DS but that doesnt mean its worth the time investment.
Naval War: Arctic Circle,PC,Apr-10-2012,Turbo Tape Games,Strategy | Real-Time | Military | General,Everyeye.it,50,Naval War: Artic Circle could have been a good title but it lacks in so many aspects gameplay-wise that in the end it is not very satisfying for the RTS fan. The missions are too simple and the multiplayer should be enhanced with more maps and scenarios. On top of this a poor technical realization.
Go Vacation,Wii,Oct-11-2011,Namco Bandai Games,Miscellaneous | Party | Party | Party / Minigame,Gamereactor Sweden,20,When I played Go Vacation I heard the ticking clock of my life eating up the hours as I struggled with the pointless mini-games. You can avoid this. For me its too late.
Transformers: Revenge of the Fallen - Autobots,DS,Jun-23-2009,Vicarious Visions,Action | Adventure | Shooter | Beat-'Em-Up | Sci-Fi | Sci-Fi | Third-Person | 3D | Arcade,Worth Playing,50,Overall Im not sure that Id suggest Transformers: Revenge of the Fallen – Autobots to anyone other than die-hard Transformer fans even though it really doesnt do the franchise any justice.
Gear.Club Unlimited,Switch,Nov-21-2017,Eden Games Mobile,Action | General | Racing | Simulation | Automobile,JeuxActu,45,Gear.Club Unlimited is just a bad port of an otherwise successful mobile racing game. Even if the content is generous the game is expensive the gameplay is a joke the AI is crap and the graphics are ugly. Dont bother with this one if you really like cars and racing games.
Lucky's Tale,PC,Mar-28-2016,Playful Corp.,Action | Platformer | 3D,GameSpot,50,Luckys Tale seems like it would be a good fit for someone who doesnt normally play games and has mild curiosity in VR. Experienced players will certainly appreciate the great controls but thats it. Its hard to get upset about a game thats technically free but its worth acknowledging that Luckys Tale is too basic to get excited about and not inventive enough to communicate the potential of VR.
Crystal Quest,Xbox 360,Feb-5-2006,Stainless Games,Action | Shooter | Shooter | Static | Shoot-'Em-Up | Top-Down,X-ONE Magazine UK,40,Tat. [Issue#5 p.120]
Atari Classics Evolved,PSP,Dec-19-2007,Stainless Games,Miscellaneous | Compilation | Compilation,Game Revolution,42,On the one hand there are more than sixty games available in portable form. Some of them have even been genuinely enhanced if youre interested. Unfortunately many players probably wont have the patience to unlock the full library of classics and will be stuck with the eleven that are available from the start.
Dusk Diver,PlayStation 4,Oct-29-2019,JFi Games,Action | Role-Playing | General | Action RPG,Cubed3,50,Dusk Diver struggles to make a memorable impact due to its story and gameplay failings. This is not helped by its technical issues. Nevertheless despite its blandness there is some charisma beneath the surface thanks to a memorable supporting cast and a clear sense of passion in its worlds conception. Its difficult to recommend it but for those who do give it a go there is a noteworthy personality here that keeps things ticking.
Dragon Ball Z Budokai HD Collection,PlayStation 3,Nov-6-2012,Pyramid,Miscellaneous | Compilation | Compilation,Eurogamer Italy,50,The Dragon Ball Z Budokai HD Collection is pretty dumb. Budokai 3 is still a great game but the lack of any kind of online mode and the crazy absence of Budokai 2 transform a good chance into a sad nonsense.
Conduit 2,Wii,Apr-19-2011,High Voltage Software,Action | Shooter | Shooter | First-Person | Sci-Fi | Sci-Fi | Arcade,Joystiq,20,Theres only one 4-minute bit in the entire thing that was fun to play and that was tailgunning in the spaceship. So at least the whole review wasnt negative amirite?
Defiance,PC,Apr-2-2013,Trion Worlds,Massively Multiplayer Online | Role-Playing | Sci-Fi | Action | Shooter | Shooter | Third-Person | Sci-Fi | Sci-Fi | Arcade,Quarter to Three,40,Defiance is mostly lacking meaningful connective tissue. It fails at the fundamental task of feeling like a thoughtfully designed and polished game. It fails at feeling like a world. It fails at giving you much to look forward to once you’ve realized you’ve seen most of what it’s ever going to do. You can only get so far with it’s fun to shoot stuff. About Defiance far.
Battles of Prince of Persia,DS,Dec-6-2005,Ubisoft Montreal,Strategy | Miscellaneous | Turn-Based | Card Battle | Card Battle,Modojo,40,A strategic card battler thats missing out on any fun intuitive design or worst of all a point. Stick to your Advance Wars and leave this battlefield empty.
Star Wars Jedi Knight II: Jedi Outcast,Switch,Sep-24-2019,Aspyr | Aspire,Action Adventure | Linear,Cubed3,50,A flawed port that struggles to overcome mediocrity in its implementation and that suffers from a lack of multiplayer leads to a less than stellar experience. Star Wars Jedi Outcast is purely saved by its solid level design and fan service. There are probably better options if you want a good TV experience but nothing can beat this ports portable experience which is in all honestly its saving grace. Recommended for fans looking to take it on holiday and a near miss for fans looking for a Star Wars title worthy of being played in the big screen.
Tokyo Twilight Ghost Hunters: Daybreak Special Gigs,PlayStation 4,Sep-20-2016,Arc System Works | Now Production,Strategy | Turn-Based | General,ZTGD,50,Tokyo Twilight Ghost Hunters Daybreak is a title that showed a lot of promise with a great art style and an interesting premise. However the atrocious combat mechanics hinder the overall enjoyment of the game so much to the point it’s difficult to recommend to anyone in particular.
Master of Orion 3,PC,Feb-25-2003,Quicksilver Software,Strategy | Turn-Based | Sci-Fi | 4X,GMR Magazine,10,Then theres the weak arbitrary enemy A.I. the impenetrable interface and the absurdly incomplete documentation. [June 2003 p.70]
Fallout: New Vegas - Honest Hearts,Xbox 360,May-17-2011,Obsidian Entertainment,Role-Playing | First-Person | First-Person | Western-Style,Metro GameCentral,50,A typical Fallout download that buries a few interesting new ideas and locations beneath a patchwork of overfamiliar and increasingly outdated content.
Cargo! The Quest for Gravity,PC,Apr-21-2011,Ice-Pick Lodge,Miscellaneous | Action Adventure | Fantasy | General | General | Fantasy,PC PowerPlay,40,Proof that gleeful surrealism does not automatically indicate arthouse brilliance. [Aug 2011 p.74]
theHunter: Call of the Wild,PC,Feb-16-2017,Expansive Worlds,Sports | Individual | Nature | Hunting,TheSixthAxis,40,When theHunter: Call of the Wild works properly it’s still going to be a game that only those with the patience of a saint would enjoy. It’s very slow full of barriers and isn’t very exciting. That’s not to say it’s not completely without merit as it’s a stunner to look at and there are rare occasions where everything comes together to make a compelling experience. Just note that those rare occasions are few and far between.
StarDrone,PlayStation 3,Apr-5-2011,Beatshapers,Action | General | General,Playstation Official Magazine UK,30,It just isnt any fun. [Apr 2011 p.114]
Fallout: Brotherhood of Steel,PlayStation 2,Jan-14-2004,Interplay,Role-Playing | Action RPG,Eurogamer,30,If you have any respect for the way games should be made then give Interplay a clear message that it simply has to do better than this to compete in the games market. Treat BOS with contempt it deserves and avoid it at all costs - even buying this at a budget price would be irresponsible.
Mission: Impossible: Operation Surma,PlayStation 2,Dec-8-2003,Paradigm Entertainment,Action Adventure | Modern,games(TM),30,Dilute disjointed and uninspiring. Feeling more like a staggered set of obstacles than a wholesome game the action sadly boils down to little more than a tediously dull showcase for your equipment and abilities which are put into use against some questionable AI stooges. [Jan 2004 p.118]
Heroes of Might and Magic IV: The Gathering Storm,PC,Sep-26-2002,3DO,Strategy | Turn-Based | Fantasy | General,Computer Gaming World,30,Its a lot more of the same - the same grinding disenchantment. [Feb 2003 p.80]
ESPN Winter X-Games Snowboarding 2002,PlayStation 2,Jan-14-2002,Konami,Sports | Alternative | Snowboarding,Gaming Age,42,No matter what type of game you are looking for the control takes some getting used to.
Silent Scope 2: Dark Silhouette,PlayStation 2,Sep-18-2001,KCET,Action | Shooter | Rail,Game Revolution,42,This is one port that went from arcade star to console dog. Heinous dude.
Heroes of Might and Magic: Quest for the Dragon Bone Staff,PlayStation 2,Apr-18-2001,New World Computing,Role-Playing | PC-style RPG,PSX Nation,40,If you love this series on PC then stick to it there because the essence of what makes HMM is just hinted at on PS2.
Jagged Alliance 2: Unfinished Business,PC,Nov-30-2000,Sir-Tech Software Inc.,Strategy | Turn-Based | Modern | Tactics,Daily Radar,0,A pale shadow of a flawed but fun game. If the designers do not have more in them than this the Jagged Alliance series should end here.
Assassin's Creed Liberation HD,PlayStation 3,Jan-14-2014,Ubisoft Sofia,Action Adventure | Historic | Historic | Open-World,Playstation Official Magazine UK,50,Sadly Liberation can’t escape its limited gameplay technical unevenness and poorly told story. While Black Flag kicked the series on the past holds no glory for Aveline.
UEFA Euro 2012,PC,Apr-24-2012,EA Canada,Sports | Traditional | Team | Soccer | Sim | Sim,GRYOnline.pl,35,A waek game in almost every aspect - the most painful being missing licences and castrated game modes that were supposed to be the biggest advantages of this game. Well made stadiums supporters songs and new commentary track are not enough to justify a high price tag.
We Cheer 2,Wii,Nov-3-2009,Machatin | Inc.,Action | Miscellaneous | Rhythm | Dancing | Dancing,Game Revolution,42,I guess if you find yourself in need of a game for a preppy young lass this could be a recipe for success. If youre a fan of rhythm games there isnt anything here of substance so any fun you have while waving to an imaginary virtual jailbait kid wont last too long.
Murder in the Abbey,PC,Aug-26-2008,Alcachofa Soft,Adventure | General | General,IGN,35,The back of the box promises 40 hours of gameplay. You do not want 40 hours of gameplay here.
Wild ARMs XF,PSP,Mar-11-2008,Media Vision,Strategy | Turn-Based | Fantasy | General | Fantasy | Tactics,1UP,42,The game has some ambition and I admire that. But in the end a score is based on how much fun I have (thats why we play right?) and I had very little fun playing Wild Arms XF. This says it all: I cant wait to whip out strategy gems like Final Fantasy Tactics or Disgaea on my commute...but I had to force myself to drag out XF.
The Sinking City,PlayStation 4,Jun-25-2019,Frogwares,Action Adventure | Survival,GameSpot,30,Its hard to resent a game as unapologetically dweeby as The Sinking City. Its an old-fashioned bookish mystery rooted in the mythology and mysteries of a pulpy cult-favorite mid-century American novelist--an effort not without charm to be sure. But no matter how fond your affection for H.P. Lovecraft and the idea of a wide-eyed slow-burn literary adventure the poor design cliched writing and lumbering pace make this far more tedious than delightful let alone unsettling or terrifying.
Corruption 2029,PC,Feb-17-2020,The Bearded Ladies Consulting,Strategy | Turn-Based | General,LEVEL (Czech Republic),40,The game does not offend but also doesn´t inspire. If it had more original content it would certainly receive a more positive feedback. Therefore it is only an average game. [Issue#302]
Urban Trial Freestyle,3DS,Jun-27-2013,Strangelands Ltd.,Miscellaneous | Driving | Racing | General | Arcade | Arcade | Automobile,DarkStation,20,I really enjoyed the previous versions of this game but the 3DS version is sadly just not worth anyone’s time.
The Legend of Korra,PC,Oct-21-2014,PlatinumGames,Action Adventure | General | Fantasy,CD-Action,60,Without Activision at the helm and its policy on licensed games – done too quickly and too cheap – it could have been an epic adventure. [01/2015 p.80]
Pressure,PC,Mar-26-2013,Chasing Carrots,Action | Racing | General | General | Arcade | Automobile,4Players.de,50,The steampunk approach in track and vehicle design is charming but mechanics lack variety and most of all tight controls regardless if you enter the course with a gamepad keyboard or mouse at your disposal.
Dragon Age II: Legacy,Xbox 360,Jul-26-2011,BioWare,Role-Playing | PC-style RPG | Action RPG,Eurogamer,50,A passable addition to the game but one that doesnt do anything to make itself essential. Better than a lot of BioWare DLC packs but nowhere near as satisfying as their best work.
MXGP Pro,PlayStation 4,Jul-10-2018,Milestone S.r.l,Racing | Arcade | Automobile,Push Square,30,Saying that Milestone need to take a step back with its dirt bike games and rework everything is becoming as tired a statement as saying Telltale needs to use a new engine. But it remains true yet again with MXGP Pro. A very slight improvement over MXGP 3 but a noticeable step back from Monster Energy Supercross MXGP Pro is largely a spectacular disaster. It gets a couple things right and offers a new slate of tracks to race on but you’ll be too busy slamming your head into a wall to really notice.
Chasing Aurora,Wii U,Nov-18-2012,Broken Rules,Action | General | Flight | Flight,Everyeye.it,45,Chasing Aurora is a Competitive Party Game that does not work. The weakness of the gameplay structure and a not involving single player made every effort useful. A bad game to stay away from.
Deadcore,PlayStation 4,Jul-14-2017,Grip Games,Action | Shooter | First-Person | Arcade,TheSixthAxis,30,Challenge fiends may still have a good time with DeadCore although in its current state I would be reluctant to recommend the console port over the PC version – if you have one. Originally a project by a fledgling group of five young French developers DeadCore shows some promise as a platforming first title: the basic mechanics are generally good and fun to use. It’s a shame the game is entirely let down by poor controls and sometimes cheap challenge design both of which are at odds with the game’s speedrunning ethos.
Sonic Heroes,PlayStation 2,Jan-27-2004,Sonic Team,Action | Platformer | 3D,NTSC-uk,30,Its tricks are old and it offers no challenge but for the irksome nuisances of its design. [JPN Import]
Egg Mania: Eggstreme Madness,GameCube,Sep-11-2002,Kemco,Miscellaneous | Puzzle | General,IGN,53,Its just a game concept that wears off quickly.
Harry Potter and the Sorcerer's Stone,PlayStation,Nov-15-2001,Argonaut Games,Action Adventure | Fantasy,GameSpot,40,A lesson in boredom. Without a jump command the platforming elements are all but wasted while the spell-flinging portions of the game are equally forgettable.
Test Drive Off-Road Wide Open,Xbox,Nov-14-2001,Rockstar San Diego,Driving | Racing | Rally / Offroad,All Game Guide,40,All of the problems the off-road games have experienced in the past are as visible in this version as a Hummer with its high beams on.
4x4 Evolution,PlayStation 2,Feb-26-2001,Terminal Reality,Driving | Racing | Rally / Offroad,All Game Guide,40,The racing environments suffer from the PlayStation 2s notorious texture limitations.
Gunbird 2,Dreamcast,Nov-17-2000,Psikyo,Action | General,Daily Radar,0,All flash and no substance Gunbird 2 is too hard too short and too boring to even bother looking at.
JoJo's Bizarre Adventure HD Ver.,PlayStation 3,Aug-21-2012,Capcom,Action | Fighting | Fighting | 2D | 2D,Game Revolution,40,There are isolated moments of the funny and interesting like one of the 26 fighters being a small dog (I think its a chihuahua but Im not entirely sure). It makes me feel like a bad person but kicking a possessed dog is mildly amusing… the first time. Then it becomes another cheap and frustrating match with the AI.
Sid Meier's Pirates!,Wii,Sep-28-2010,Virtuos,Strategy | General | General,GameZone,35,Sid Meiers Pirates! is another perfect example of a great game gone bad when its poorly ported to consoles. Skip Sid Meiers Pirates; unless you are a glutton for punishment.
SimCity,PC,Mar-5-2013,Maxis,Miscellaneous | Virtual Life | Strategy | City Building | Management | Modern | Modern | Government,Quarter to Three,20,If Electronic Arts is going to make a game with the basic premise being that no city is an island if theyre going to stress the interaction among cities if theyre going to make playing alongside other people a cornerstone of the design if theyre going to force my creations into tiny boxes that cannot exist past a certain point without the help of other tiny boxes theyre going to have to do the hard work of making it actually work. And ideally that hard work should be done before they sell people the game not after theyve been caught flat-footed for botching it so completely.
Gods Will Be Watching,PC,Jul-24-2014,Devolver Digital,Adventure | General | Point-and-Click,Riot Pixels,35,In 2013 Deconstructeam entered a Ludum Dare competition with a bare bones concept of a game. Now a year later this game has a price tag but it’s bare just as it was back then.
Planet of the Eyes,Xbox One,Sep-12-2017,Coco Cucumber | Cococucumber,Action | Platformer | 2D,XBLA Fans,40,Planet of the Eyes is a surprisingly short game clocking in at around an hour and a half. The game just doesnt have the level of polish that allows such a length to be excusable. Its an incredibly simplistic take on gameplay and narrative ideas weve all seen a million times before never doing anything new or memorable. Even at its best it amounts to little more than a bland experience one that will be over quickly and easily forgotten.
Hell Yeah! Wrath of the Dead Rabbit,PC,Oct-3-2012,Arkedo Studio,Action | Platformer | Platformer | 2D | 2D,IGN,49,There are good ideas but thats not enough.
Of Orcs and Men,Xbox 360,Oct-24-2012,Cyanide | Spiders,Role-Playing | Action RPG | Action RPG | Western-Style,GameOver.gr,40,You could say that Of Orcs and Men reminds us of games of the distant past but we cant remember RPGs of the old days being so bad. Despite its surprisingly fun and interesting story Of Orcs and Men is a game that struggles and fails to achieve mediocrity.
The Lord of the Rings: Tactics,PSP,Nov-8-2005,Amaze Entertainment,Strategy | Turn-Based | Fantasy | General | Fantasy | Tactics,Computer Games Magazine,30,Its a short vacuous game thats over quickly and even more quickly forgotten. [Feb 2006 p.93]
Musashi: Samurai Legend,PlayStation 2,Mar-15-2005,Square Enix,Role-Playing | Action RPG,Computer and Video Games,30,Theres a smattering of good ideas in Samurai Legend but theyre quickly crushed under the obesity of mindless combat and poor design. One to avoid. [PSW]
SpongeBob Squigglepants 3D,3DS,May-17-2011,WayForward,Miscellaneous | General | General,Gamekult,40,Quotation forthcoming.
Restaurant Empire II,PC,May-26-2009,Enlight Software,Strategy | Tycoon | Management | Tycoon | Business / Tycoon,LEVEL (Czech Republic),40,You can admire the complexity and new ideas in Restaurant Empire 2 like cafés or patisseries but you can’t deny the confusing controls and the fact it soon gets repetitive and boring. [Aug 2009]
Disney*Pixar WALL-E,PSP,Jun-24-2008,Heavy Iron Studios | Savage Entertainment,Action | Platformer | Platformer | 3D | 3D,Gaming Age,33,For the handhelds the PSP version resembles the home console titles for the most part but with the worst visuals of the bunch. The controls also feel completely off and the entire game is more frustrating to play than the other titles.
Hardwood Hearts,Xbox 360,Dec-8-2005,Silver Creek Entertainment,Miscellaneous | Parlor | Gambling | Board / Card Game | Gambling,X-ONE Magazine UK,40,No attempt at making its single-player outing more interesting than exhibition matches also stinks. [Issue#23 p.97]
SIMULACRA,Switch,Dec-3-2019,Kaigan Games OU,Simulation | Virtual | Virtual Life,Screen Rant,50,Simulacra is a horror game about investigating a missing girls cellphone that has moments of brilliance but doesnt quite live up to its concept.
Snooker 19,PlayStation 4,Apr-16-2019,Lab42,Sports | Individual | Billiards,Gamer.nl,60,Snooker 19 does the absolute minimum of what you may expect from a snooker game. Playing snooker is fun but as a package this game is a let-down.
The Council - Episode 5: Checkmate,PlayStation 4,Dec-4-2018,Big Bad Wolf,Adventure | General,Jeuxvideo.com,55,This final chapter of The Council shines in its art design and provides a great way to take sides in the final intrigue. Unfortunately the ending is expeditive and a bit disappointing. Moreover the game still having some problems with animations lips sync and framerate.
Grand Ages: Medieval,PlayStation 4,Oct-13-2015,Gaming Minds Studios,Strategy | Real-Time | General,Riot Pixels,30,In an attempt to please all kinds of strategy players by adding city building trading and wars Grand Ages: Medieval miserably fails on all accounts.
WRC 2: FIA World Rally Championship 2011,PlayStation 3,Oct-14-2011,MileStone Inc.,Driving | Racing | Rally / Offroad,Metro GameCentral,50,The official World Rally Championship game is looking tired on just its second outing with very few improvements to the first game and far too many flaws.
Alien Breed 3: Descent,PC,Nov-17-2010,Team17,Action | Shooter | Shooter | Third-Person | Sci-Fi | Sci-Fi | Arcade,IncGamers,27,Wedged between survival horror and arcade shooter - but succeeding at neither - Descent is a poorly designed camera-hampered end to an already weak trilogy.
Kholat,PC,Jun-9-2015,IMGN.PRO,Fantasy | Adventure | 3D | First-Person,GameSpot,40,Its ideas reveal the game Kholat wanted to be but its aspirations soar far higher than the game it became. What good is a mystery if you dont care about what it might tell you?
Sid Meier's Starships,PC,Mar-12-2015,Firaxis Games,Strategy | Turn-Based | General,Riot Pixels,25,This awful strategy game is not worthy of even a single playthrough neither on PC nor on tablets.
Infliction: Extended Cut,PlayStation 4,Feb-25-2020,Caustic Reality,Adventure | 3D | First-Person,The Digital Fix,40,Infliction: Extended Cut derives almost all of its best ideas from much better games making the whole thing feel like a chore rather than an ordeal. It simply does not cut it.
Harry Potter and the Half-Blood Prince,PC,Jun-30-2009,EA Bright Light,Action Adventure | Fantasy | General | Fantasy,PC Format,46,At times it feels like Dead Ringers the Game with a load of people doing not-quite accurate impressions while looking rather unlike the real actors. [Sept 2009 p.98]
Zoo Tycoon 2: Endangered Species,PC,Oct-19-2005,Blue Fang Games,Strategy | Tycoon | Management | Tycoon | Business / Tycoon,Gaming Horizon,49,It’s a CD that adds about 20 endangered animals to your existing game of Zoo Tycoon 2 and that’s about it.
Accel World vs. Sword Art Online: Millennium Twilight,PlayStation 4,Jul-7-2017,Artdink,Role-Playing | Action RPG,GameOver.gr,30,Accel World Vs. Sword Art Online besides being addressed to a very limited audience comes with many problems (technical and design-wise) which means that even hardcore fans of the two franchises will be discouraged by the problematic nature of the title.
Star Soldier R,Wii,May-19-2008,Hudson Soft,Action | Shooter | Shooter | Scrolling | Scrolling | Shoot-'Em-Up | Vertical,Gamervision,40,While Star Soldier isnt the deepest most nuanced game available it has some pretty tight shooting and fast-paced game play. If youre that second type of gamer who just has to have the highest score you may find 8 dollars worth of game play. Otherwise save yourself some money and finger pain.
Yosumin! LIVE,Xbox 360,May-27-2009,Square Enix,Miscellaneous | Puzzle | Puzzle | General | General,GameSpot,55,This color-matching game is too random and shallow to entertain for long.
SingStar ABBA,PlayStation 2,Dec-2-2008,SCEE London Studio,Miscellaneous | Rhythm | Music,IGN,55,I love SingStar but feel these artist-specific titles are missteps. Theres not enough content for the price; the scope is super-limited; and even if you love ABBA youll need ABBA-obsessed friends to have a decent party with this title.
