title , platform , release_date , developer , genres , reviewer , metascore , review
Far Cry 2,PC,Oct-21-2008,Ubisoft Montreal,Action | Shooter | Shooter | First-Person | Modern | Modern | Arcade,PC PowerPlay,100,The unique setting brilliant AI and palpable atmosphere make Far Cry 2 a quintessential PC gaming experience. [Dec 2008 p.63]
Professor Layton and the Curious Village,DS,Feb-10-2008,Level 5,Miscellaneous | Adventure | Puzzle | Edutainment | General | Puzzle | General,GameShark,100,One of the finest debuts of a new IP in some time and does an incredible job of combining two areas the DS seems to have been made for: puzzles and adventure gaming. The addictive gameplay twisting story charming characters and beautifully drawn animation makes this a game that neither puzzle fans nor adventure game fans should miss.
The Walking Dead: Episode 3 - Long Road Ahead,PC,Aug-29-2012,Telltale Games,Miscellaneous | Adventure | General | Compilation | Point-and-Click,ZTGD,95,Episode 3 is the one episode that really makes you think. It's a rough emotional ride that will make you want to replay the episode to see what exactly would happen if you changed your choices. It really is the best episode in the series so far. It will be very difficult to top this one. The cliffhanger to this episode will guarantee that you will want to play the next. I highly suggest the entire series and especially this episode without any doubts.
AudioSurf,PC,Feb-15-2008,BestGameEver.com,Action | Miscellaneous | Rhythm | Music | Music,1UP,95,I can see anyone coming back to this again and again over the next few years and that's more than enough to justify the peanuts they're asking for Audiosurf.
Final Fantasy X / X-2 HD Remaster,Xbox One,Apr-16-2019,Virtuos,Miscellaneous | Compilation,TheXboxHub,100,This is the perfect entry point into the series for newcomers. And for everyone else it is one of the best JRPGs of all time.
Yakuza 0,PlayStation 4,Jan-24-2017,Ryu ga Gotoku Studios,Action Adventure | Open-World,LEVEL (Czech Republic),100,Mood pathos emotion humor ... and helluva fights. This is a combination that makes Yakuza zero the one of the most entertaining game in the whole series. For lovers of Japan Y0 is a must-have. [Issue#272]
Super Mario 64 DS,DS,Nov-20-2004,Nintendo,Action | Platformer | Platformer | 3D | 3D,GameSpy,100,Its greatness holds up almost ten years later. It's a treat having an enhanced (both gameplay-wise and visually) version of the game that you can toss in your pocket and play on the go. This is easily the best launch title in the DS lineup.
Dead Rising,Xbox 360,Aug-8-2006,Capcom,Action Adventure | Horror | Horror | Open-World,Yahoo!,100,The spaced out save points create a wonderfully rare sense of dread. You'll want to stock up on inventory and weapons before attempting a particularly difficult passage. And you're not always secure whether you're going to make it. This is where Dead Rising's sandbox zombie killing comes into its own.
MLB The Show 17,PlayStation 4,Mar-28-2017,Sony Interactive Entertainment,Sports | Team | Baseball | Sim,Gaming Age,100,Of course if I'm being honest offline single-player is what I care about most when it comes to MLB The Show anyway so it's not like multiplayer was going to change my opinion too much one way or the other. And from that perspective — that is as someone who's probably going to spend a few hundred hours with the game over the next year with 95% of that being in RTTS — I have to say that MLB The Show 17 once again delivers.
BattleBlock Theater,PC,May-15-2014,The Behemoth,Action | Platformer | 2D,Hardcore Gamer,90,BattleBlock Theater doesn’t do anything particularly new but that’s perfectly okay because everything it does do it does without a hitch to speak of.
Dragon Ball FighterZ,PC,Jan-26-2018,Arc System Works,Action | Fighting | 2D,DualShockers,90,To put it simply Dragon Ball FighterZ is stunning in motion.
Star Wars: Knights of the Old Republic II - The Sith Lords,PC,Feb-8-2005,Obsidian Entertainment,Role-Playing | Third-Person | Third-Person | General,Worth Playing,95,The epic struggles of the universe are told in a cinematic moving style. The interpersonal conflicts are brought out through rich dialogue and well thought-out storytelling.
Destiny 2,PlayStation 4,Sep-6-2017,Bungie,Action | Shooter | First-Person | Arcade,GameSpace,100,Destiny 2 is an epic: a story with an ever expanding scale made greater by the heroes of whom the story is told with tragedy struggle and redemption. It is very fitting that the score to accompany it must be too. And it is. There were moments that I had to put the controller down and simply listen taking in the scope of what I was experiencing.
AMID EVIL,PC,Jun-20-2019,Indefatigable,Action Adventure | General,PC Invasion,90,Amid Evil is simultaneously breathtaking and exhilarating in a way that most of its ilk could never hope to be. It's truly an epic adventure filled with impressive sights and dangerous foes.
Mario Kart 7,3DS,Dec-4-2011,Retro Studios | Entertainment Analysis & Development Division,Driving | Racing | Arcade | Kart | Kart | Automobile,Gameblog.fr,100,With almost ten years of thrilling races behind them even the most fine-tuned racing fireballs can show signs of fatigue. But rather than risking a break-down Nintendo was smart enough to dismantle its Mario Kart core formula in order to correctly refreshen each and every one of its clogs before putting them back together. As an added bonus the mechanic repainted it nicely and added some of the latest technologies. The end result roars at soon as the engine starts and promises to run nicely for quite some time thanks to solid online features.
Prince of Persia: The Two Thrones,Xbox,Dec-1-2005,Ubisoft,Action Adventure | Fantasy,Cheat Code Central,96,All of the game's elements mesh from the music to the storyline from the puzzles to the control system. I can't find anything nasty to say about this game. Ubisoft have certainly done their homework.
Halo: The Master Chief Collection,Xbox One,Nov-11-2014,343 Industries,Miscellaneous | Compilation | Action | Shooter | First-Person | Sci-Fi | Arcade,Digital Spy,100,There's more love and care lavished on The Master Chief Collection than you see in countless other big-money brand new blockbuster releases. The fact that the games themselves are fantastic fun online and off is the cherry on the icing.
Batman: The Enemy Within - Episode 5: Same Stitch,PC,Mar-26-2018,Telltale Games,Adventure | Point-and-Click,Attack of the Fanboy,100,Batman: The Enemy Within - Episode 5 "Same Stitch" is a near-perfect finale to an already fantastic series. Storytelling voice acting art design and every other aspect of the series has come together here and delivered one of the best episodes in Telltale's history.
NCAA Football 11,PlayStation 3,Jul-13-2010,EA Tiburon,Sports | Traditional | Team | Football | Sim | Sim,Playstation: The Official Magazine (US),90,Still amid an overdose of pomp and ceremonial broadcast presentation this simulation provides great football action and enough dream material to give high school kids goose bumps. [Oct 2010 p.84]
MVP Baseball 2005,PC,Feb-22-2005,EA Sports,Sports | Traditional | Team | Baseball | Sim | Sim,PC Gameworld,91,If you want to play a well-balanced baseball game that mixes stats and simulation with arcade action this is really your best option.
Phantasy Star Online Episode I & II,GameCube,Oct-29-2002,Sonic Team,Role-Playing | Massively Multiplayer Online | Sci-Fi,Play Magazine,100,I've logged 70 hours on the game so far and I'm nowhere near quitting. Sure I've finished the game many times already but the game's structure of almost endless goals keeps me coming back for more every single day. [Jan 2003 p.82]
Assault Android Cactus,PlayStation 4,Mar-8-2016,Witch Beam,General | Scrolling | Action | Shooter | Shoot-'Em-Up | Top-Down,Gaming Age,100,The one downside to a gorgeous fast-paced whirlwind of constant activity is that there's not much of a story to go along with it. I don't know about you but when the end result is as much fun as Assault Android Cactus that's a trade-off I have no problem making.
Persona 4 Arena Ultimax,Xbox 360,Sep-30-2014,Arc System Works,Action | Fighting | 2D,IGN,91,Its irresistible sense of style speaks for itself but given how much I love its predecessor the biggest compliment I can pay it is that it’s 100% the sequel that Persona 4 Arena deserved.
Darksiders II,Wii U,Nov-18-2012,Vigil Games,Modern | Action Adventure | Fantasy | Fantasy | Open-World,Gaming Age,100,The voice acting is all wonderfully done especially Death. He's such a great character and is very funny throughout the game especially in the way he deals with some of the side-quests that characters give him. If you already own the game there's very little incentive to picking up the Wii U version but if you've held off or never had the means to buy it until now I highly recommend the purchase.
Guitar Hero: Metallica,Wii,Mar-29-2009,Neversoft Entertainment,Action | Miscellaneous | Rhythm | Music | Music,Gaming Age,100,For fans of the Guitar Hero franchise Guitar Hero: Metallica might be the best entry we've seen yet. I was somewhat lukewarm on my reception to the other band-themed title that Neversoft put out with GH: Aerosmith but Metallica absolutely blows that game out of the water not only with the track listing but the overall time and attention put into the actual presentation and how the band seems to be infused into every aspect of the game.
Fire Emblem: Path of Radiance,GameCube,Oct-17-2005,Intelligent Systems,Strategy | Turn-Based | Fantasy,Cheat Code Central,100,With its large expansive game play and large battles around every corner. The game is hard so don't expect to beat it down with out at least sending your Gamecube into orbit at least once.
Final Fantasy XI,PlayStation 2,Mar-23-2004,Square Enix,Role-Playing | Massively Multiplayer Online | Fantasy,Stuff,100,Final Fantasy XI far outstrips "Everquest's" addictiveness in the multiplayer online role-playing realm.
Full Metal Furies,PC,Jan-17-2018,Cellar Door Games,Action | Beat-'Em-Up | 2D,GameSpace,87,Full Metal Furies is high-quality side-scrolling brawler that understands its roots while still managing to both pushes the genre forward with its inclusion of some great RPG elements as well as add its own unique style to the genre. Furies offers many hours of single-player fun and shines exceptionally well when played to its full potential as a co-op experience. I highly recommend picking this title up if you’re looking for something new and charming.
Super Mega Baseball,PlayStation 4,Dec-16-2014,Metalhead Software,Traditional | Sports | Team | Baseball | Arcade,Gaming Age,100,Because really Super Mega Baseball is the sort of fun easy to pick up diversion that video game baseball was at the very beginning of its lifespan — and if it's as great as it is here there's every reason to believe it can still fulfill that function.
NASCAR Thunder 2004,Xbox,Sep-16-2003,EA Games,Driving | Racing | Stock Car,Xbox Nation Magazine,90,One kick-ass game. If you're a fan of NASCAR racing you've never had it so good on a home console. [Dec/Jan 2004 p.97]
DDRMAX: Dance Dance Revolution,PlayStation 2,Oct-28-2002,KCET,Miscellaneous | Rhythm | Dancing,Cinescape,100,It’s a fan’s dream come true.
NASCAR Thunder 2002,PlayStation 2,Oct-15-2001,EA Sports,Driving | Racing | Stock Car,Hot Games,100,If you were looking for the ultimate NASCAR game you’ve found it.
NHL 2001,PlayStation 2,Oct-25-2000,EA Sports,Sports | Traditional | Ice Hockey | Sim,Core Magazine,100,So damned good I don't know how EA will top this performance next year.
F355 Challenge,Dreamcast,Sep-19-2000,Sega,Driving | Racing | GT / Street,Planet Dreamcast,95,I feel that in spite of the few omissions with its incredibly tight control beautiful graphics and excellent multiplayer modes F355 Challenge takes the crown for best Dreamcast racer yet and is a strong contender for best sim racer of all time!
The Elder Scrolls III: Bloodmoon,PC,Jun-3-2003,Bethesda Softworks,Role-Playing | First-Person | First-Person | Western-Style,Four Fat Chicks,100,A tremendously valuable expansion to the world of “Morrowind” adding a new story and an environment of real depth and complexity.
Boom Blox,Wii,May-6-2008,EA LA,Miscellaneous | Puzzle | Puzzle | General | Puzzle | General,1UP,100,Boom Blox may not be the best Wii game depending on your proclivities but it's definitely the best use of the Wii yet. It's immensely accessible wonderfully tactile and stands as one of the best treatments of gaming in a 3D space.
Madden NFL 08,Xbox 360,Aug-14-2007,EA Tiburon,Sports | Traditional | Team | Football | Sim | Sim,Yahoo!,100,These animations are gorgeous to look at from Reggie Bush doing his trademark summersault for six or a Chad Johnson river dance after a score. This is because the game runs at a buttery smooth 60 frames per second...Madden 08 is simply superb. If you could only own one next-gen football this is it.
Pro Evolution Soccer 2016,Xbox One,Sep-15-2015,Konami,Sports | Team | Soccer | Sim,Official Xbox Magazine UK,90,This year’s PES has improved its game in all the right areas of the pitch resulting in a pulsating best-in-class football sim – although there’s room for improvement presentation-wise.
Far Cry 2,PlayStation 3,Oct-21-2008,Ubisoft Montreal,Action | Shooter | Shooter | First-Person | Modern | Modern | Arcade,GameShark,100,This is one of the most amazing worlds in gaming and the fact that it's brimming with so much action and intrigue makes it that much better.
Rogue Legacy,PC,Jun-27-2013,Cellar Door Games,Role-Playing | General | Action | Platformer | Platformer | 2D | 2D,D+PAD Magazine,100,Roguelike games have become increasingly popular of late and it’s great to see one which rewards you for all the time spent by allowing a form of character progression. It’s mitigated to a point by having you lose all your money before entering a castle and each purchased bonus makes all the others more expensive.
BattleBlock Theater,Xbox 360,Apr-3-2013,The Behemoth,Action | Platformer | Platformer | 2D | 2D,GamingTrend,92,At 1200 MS points it’s a small price to pay for the madness and certainly lives up to its Castle Crashers pedigree for polish poise and preposterous premise.
Dragon Quest Builders 2,Switch,Jul-12-2019,Square Enix,Role-Playing | General | Action Adventure | Sandbox,VGC,100,Dragon Quest Builders 2 is the perfect sequel. The kind that improves on every aspect of the original adding more meaningful content to the mix quality of life fixes and throwing some interesting new aspects at players whilst maintaining that core that made the first game so enjoyable in the first place.
Castlevania: Lords of Shadow,PlayStation 3,Oct-5-2010,Mercury Steam,Action Adventure | Fantasy | General | Fantasy,Gaming Age,100,It's a great game separate from the franchise and definitely does a favor for the third person action genre but with the CV characters and license attached it becomes even more enjoyable for me.
Pokemon Diamond Version,DS,Apr-22-2007,Game Freak,Role-Playing | Console-style RPG | Console-style RPG | Trainer,Thunderbolt,100,Easily one of the greatest titles on the DS...Between exploring the massive towns wandering through the multi-tiered wastelands and challenging legions of trainers you’ll enjoy a lengthy adventure that no other DS game can boast.
Virtua Fighter 5,PlayStation 3,Feb-20-2007,Sega AM2,Action | Fighting | Fighting | 3D | 3D,GameSpy,100,For gamers who've mocked their PS3-owning friends it's time to suck up to them and hang out at their crib for this one. One taste of this and it's going to feel like a long long wait for the summertime release on Xbox 360.
Ikaruga,GameCube,Apr-15-2003,Treasure,Action | Shooter | Scrolling,Play Magazine,100,Treasure has crafted another masterpiece of hyper-tuned overhead shooter action the likes of which the world may never see again. [Apr 2003 p.57]
Yakuza Kiwami 2,PlayStation 4,Aug-28-2018,Sega | Ryu ga Gotoku Studios,Action Adventure | Open-World,Gaming Age,100,I really really enjoyed my time with Yakuza Kiwami 2 and as a fan of the series I’d certainly urge you to check it out. It has very few flaws outside of some minor animation issues and the occasional cumbersome combat sequence. It also feels like a much stronger remake than even Yakuza Kiwami which was no slouch to begin with. It also has some solid ties to both Yakuza 0 via the new elements and pre-existing story beats that feed into the more recent Yakuza 6. So check this one out when you get a chance you will not be disappointed.
Thief: Deadly Shadows,PC,May-25-2004,Ion Storm,Action Adventure | Fantasy | General | Fantasy,Four Fat Chicks,100,I have never seen a game use light the way Deadly Shadows does nor have I seen such realistic environments rendered on the fly. For those who can get it to work well on their systems this is an astounding visual experience.
Borderlands: The Secret Armory of General Knoxx,Xbox 360,Feb-23-2010,Gearbox Software,Action | Shooter | Shooter | First-Person | Sci-Fi | Sci-Fi | Arcade,GamePro,100,The overall attention in the Secret Armory is impressive and the quirks that made the main game so memorable are definitely present here.
Lonely Mountains: Downhill,Switch,May-7-2020,Megagon Industries,Sports | Individual | Biking,Guardian,100,I have become obsessed with this game in the last week with the moments of quiet uninterrupted intense concentration it has given me at a time when focusing is difficult. The game has a simple concept executed very well with precise controls and finely balanced difficulty but it is the magical ambience and an urge towards self-mastery that keep drawing me back hurtling downhill with my heart in my mouth.
West of Loathing,Switch,May-31-2018,Asymmetric Publications,Role-Playing | General,GameCritics,100,West of Loathing is fantastic on every level — the writing is consistently genuinely funny the intricacy and breadth of the world is truly impressive and all of the mechanical systems are perfectly geared towards make sure the player is able to go through the world and experience as much as possible without needless frustration.
Sam & Max: The Devil's Playhouse - Episode 2: The Tomb of Sammun-Mak,PlayStation 3,May-18-2010,Telltale Games,Miscellaneous | Adventure | General | 3D | Compilation | Third-Person,Play UK,92,Even better thanks to far cleverer puzzles. [Issue#194 p.102]
UFC Undisputed 3,Xbox 360,Feb-14-2012,Yuke's,Action | Sports | Fighting | Fighting | Individual | Wrestling | Combat | Wrestling,XboxAddict,96,When the dust settles and you head to your local game store or big box to buy Undisputed you won't be disappointed.
South Park: The Stick of Truth,PlayStation 3,Mar-4-2014,Obsidian Entertainment,General | Role-Playing | General,LaPS4,95,Games like this one make being a videogame fan worthy. Quality good work a breathtaking experience and fun tons of fun. South Park: The Stick of Truth is one of the best games ever on Playstation 3.
The Wolf Among Us: Episode 5 - Cry Wolf,Xbox 360,Jul-9-2014,Telltale Games,Action Adventure | Adventure | General | Fantasy | Point-and-Click,GamesBeat,95,Cry Wolf ends Telltale’s Fables series on a memorable and effective note taking everything that has worked in the series so far and amplifying it to its most spectacular.
Rogue Legacy,PlayStation 4,Jul-29-2014,Cellar Door Games,Action | Platformer | Platformer | 2D | 2D,PlayStation Universe,95,A hugely triumphant take on the Metroidvania formula that delights with its fresh take on roguelike gameplay elements Rogue Legacy empowers the player rather than punishes them and is simply one of the finest games you can play on a PlayStation platform.
Brothers: A Tale of Two Sons,PlayStation 3,Sep-3-2013,Starbreeze,Action Adventure | Fantasy | Fantasy | Linear,Giant Bomb,100,If you're the sort of person who thinks video games are capable of not just entertaining us but also making us think and feel you owe it to yourself to play Brothers.
Football Manager 2014,PC,Oct-30-2013,Sports Interactive,Sports | Traditional | Team | Soccer | Management | Management,IGN Italia,95,SI Games confirms and enhances the extraordinary work done last year making Football Manager 2014 the almost-perfect game for all the Ferguson wannabes out there. And if they keep making this game so good in a couple of years we will have to raise our top review score to 11.
Age of Wonders: Planetfall,Xbox One,Aug-6-2019,Triumph Studios,Strategy | Turn-Based | General,SomosXbox,93,Age of Wonders: Planetfall is a hugely ambitious title made up of many elements that depend heavily on one other. It offers an experience that only the most veteran of the strategy will enjoy but that anyone will know to value. It is a titanic project that offers countless hours of gameplay and endless playable possibilities as well as stories. Undoubtedly a must-have of the turn-based strategy.
System Shock: Enhanced Edition,PC,Sep-22-2015,Looking Glass Studios,Action Adventure | General,Digital Chumps,92,So good to see Night Dive Studios revive this classic and make it purchasable and playable again. If you've ever uttered the words 'cyberpunk' or like games that have the word 'shock' or "Deus Ex" in them give this one an honest try -- it may not look the part in screenshots but it's a legend.
Metal Gear Solid: The Twin Snakes,GameCube,Mar-9-2004,Silicon Knights,Action Adventure | Modern,Into Liquid Sky,100,The best game on GameCube by far and one of the best games ever in my opinion. It's a must-own for any action game fan. [Grade = A+]
EverQuest: Gates of Discord,PC,Feb-9-2004,Sony Online Entertainment,Role-Playing | Massively Multiplayer Online | Massively Multiplayer | Fantasy | Fantasy,Cheat Code Central,90,As an expansion pack this isn't a new game but it throws you enough bones to begin construction of a medium-sized graveyard.
The Lord of the Rings: The Return of the King,PlayStation 2,Nov-5-2003,EA Games,Action | Beat-'Em-Up,GameNow,100,The graphics are first rate and the action is intensely frenetic. Most important ROTK turns up the LOTR authenticity full blast. [Jan 2004 p.55]
The Sims,GameCube,Mar-25-2003,Edge of Reality,Miscellaneous | Virtual Life,Gamezilla!,96,Everything the PC version was and more. With pleasing graphics and all new modes of play you’ll find that there’s a whole new meaning to the adage "get a life."
NASCAR Thunder 2003,GameCube,Sep-19-2002,EA Sports,Driving | Racing | Stock Car,GameZone,93,Stunning to look at and a joy to play. The racing dynamics are excellent and everything is in place for the best racing experience to date on the GameCube.
FIFA 2001 Major League Soccer,PC,Oct-30-2000,EA Sports,Sports | Traditional | Team | Soccer | Sim | Sim,Daily Radar,100,Players who preferred last year's fast arcade feel can boost up the speed in the options settings but fans of more thoughtful deliberate play will likely enjoy the challenge and pace of this year's iteration.
Fight Night 2004,Xbox,Apr-5-2004,EA Sports,Sports | Traditional | Boxing,GamePro,100,Fight Night's Career mode should be the model that other boxing games should follow...Hands down Fight Night 2004 is the victor in all weight classes this year. [May 2004 p.84]
Wipeout: Omega Collection,PlayStation 4,Jun-6-2017,Sony Interactive Entertainment,Racing | Arcade | Futuristic,GameOver.gr,95,This collection of updated WipEout games is really proof of how these great games have withstood the test of time. Packed with content and with superb technology to back it up Omega Collection is a must-have for fans of Sony’s futuristic racing franchise.
Mortal Kombat XL,PlayStation 4,Mar-1-2016,NetherRealm Studios,Action | Fighting | 2D,CD-Action,95,The ultimate edition of the best fighting game currently available. [05/2016 p.59]
Lego Star Wars II: The Original Trilogy,Xbox,Sep-12-2006,Traveller's Tales,Action Adventure | Sci-Fi,Times Online,100,You could play straight through this game in a few hours or dally with it for days. Therein lies its brilliance.
Sid Meier's Civilization V: Brave New World,PC,Jul-8-2013,Firaxis Games,Strategy | Turn-Based | Historic | Historic | 4X,DarkStation,100,Really the best part about Brave New World is that it’s finally addressed every victory condition in the game and made each one not only more equally viable but also just as busy. Weaponizing culture works to bring it more in line with the other conditions–it’s something you have to work towards and not something you just happen to achieve. On top of that the diplomacy changes make this system more interesting as well and it all comes down to one thing: if you have Civilization V and want to play more you owe it to yourself to get this expansion.
The Warriors,Xbox,Oct-17-2005,Rockstar Toronto,Action | Beat-'Em-Up,Detroit Free Press,100,Not only is this game true to the classic cult film from 1979 it conjures the same sinister themes and underlying social tension in a way that's pretty darned smart for something called a game.
Red Faction: Guerrilla,Xbox 360,Jun-2-2009,Volition Inc.,Action | Shooter | Shooter | Third-Person | Sci-Fi | Sci-Fi | Arcade,GamePro,100,Though the game has a few faults such as some occasional background pop-in and a few minor AI issues the whole experience is a blast (literally) and you'd be missing a great action experience by not checking this one out.
Geometry Wars 3: Dimensions,PlayStation 4,Nov-25-2014,Lucid Games,Action | Shooter | Static | Shoot-'Em-Up | Top-Down,IGN Italia,93,Geometry Wars 3: Dimensions' Adventure Mode is the best way to play Geometry Wars. Engaging addictive hard to master. If you love Geometry Wars you can't miss this entry in the series.
